{
  "schemaVersion": "midas.authority.v1",
  "authorityOrder": [
    "current-request",
    "project-constitution",
    "live-evidence",
    "verified-results",
    "approved-human-decision",
    "project-context",
    "work-order",
    "memory",
    "handoff"
  ],
  "conflictPolicy": {
    "higherAuthorityWins": true,
    "liveEvidenceOverridesMemory": true,
    "verifiedResultsOverrideSelfReport": true,
    "markUnknownWhenUnverified": true,
    "doNotInferSecrets": true
  },
  "protectedInvariants": [
    {
      "id": "no-secret-read",
      "statement": "Secret values, credentials, tokens, private keys, auth stores, and environment files are never read, printed, summarized, or committed by default.",
      "owner": "security",
      "verification": ["secret-scan", "workspace-validator"]
    },
    {
      "id": "public-boundary",
      "statement": "Public framework files must stay source-neutral and must not include non-public operating material, product-specific context, provenance trails, or unsupported benchmark claims.",
      "owner": "maintainer",
      "verification": ["public-boundary-scan", "release-gate"]
    },
    {
      "id": "evidence-before-claim",
      "statement": "Completion, release readiness, benchmark, security, and compatibility claims require local evidence recorded in the run ledger or a reviewable artifact.",
      "owner": "reviewer",
      "verification": ["run-ledger", "test-suite", "diff-inspection"]
    },
    {
      "id": "approval-gates",
      "statement": "Deploys, public releases, public claims, money movement, destructive operations, external messages, and approval-policy changes require explicit approval before execution.",
      "owner": "owner",
      "verification": ["approval-record", "release-gate"]
    }
  ],
  "verificationPolicy": {
    "beforeClaimingDone": [
      "run-local-checks",
      "inspect-diff",
      "record-evidence",
      "update-run-ledger",
      "no-unverified-claims"
    ],
    "requiresFailedCheckRepairPacket": true,
    "claimRequiresEvidence": true
  },
  "escalationRules": [
    {
      "id": "destructive-action",
      "trigger": "Deleting, overwriting, rewriting history, or performing a hard-to-reverse local operation.",
      "requiresApproval": true
    },
    {
      "id": "secret-or-credential-access",
      "trigger": "Reading, printing, forwarding, storing, or modifying secrets, credentials, tokens, private keys, environment files, or auth/browser storage.",
      "requiresApproval": true
    },
    {
      "id": "external-service-or-provider",
      "trigger": "Changing provider, auth, model route, endpoint, account, webhook, or external-service configuration.",
      "requiresApproval": true
    },
    {
      "id": "public-claim-or-release",
      "trigger": "Publishing, pushing, packaging for public release, submitting a benchmark, or making a public performance/security/compatibility claim.",
      "requiresApproval": true
    },
    {
      "id": "payment-or-money",
      "trigger": "Creating or changing prices, checkouts, invoices, subscriptions, refunds, charges, or other money-moving records.",
      "requiresApproval": true
    },
    {
      "id": "deploy-or-migration",
      "trigger": "Deploying, migrating data, changing production schemas, or modifying live infrastructure.",
      "requiresApproval": true
    }
  ],
  "claimPolicy": {
    "claimCeilings": [
      "local-validation",
      "private-benchmark",
      "public-benchmark",
      "release-ready"
    ],
    "publicClaimsRequireApproval": true,
    "benchmarkClaimsRequireRawResults": true,
    "unknownsStayUnknown": true
  }
}
